id,batch,name,screen_name,profile_url,profile_image,description,location,url,time_zone,followers_count,following_count,statuses_count,verified,created_at
16895951,1,"Patrick Meier",PatrickMeier,https://twitter.com/PatrickMeier,https://pbs.twimg.com/profile_images/2283251939/fa994c3ffxaqy22lp0f1_normal.png,"Pioneering Next Generation Humanitarian Technologies | 5x @TEDx Speaker | @RockefellerFdn, @PopTech, @NatGeo Fellow | @Stanford PreDoc | @FletcherSchool PhD","Washington DC",http://t.co/2bS00LTxyT,"Eastern Time (US & Canada)",15130,824,7674,0,"2008-10-21 23:09:45+00:00"
38027006,1,"Dr Jemilah Mahmood",JemilahMahmood,https://twitter.com/JemilahMahmood,https://pbs.twimg.com/profile_images/378800000746408517/60cf03f1bf09c097c16ca9f1738d88fc_normal.jpeg,"Chief World Humanitarian Summit Secretariat at UN in NYC, Doctor, Founder@MERCYMalaysia,","",,,1259,189,6221,0,"2009-05-05 21:35:38+00:00"
54587658,1,ScraperWiki,ScraperWiki,https://twitter.com/ScraperWiki,https://pbs.twimg.com/profile_images/1763676683/tractor_normal.png,"Tools to get, clean and analyse data from web pages, PDFs and Twitter","Liverpool, UK",http://t.co/vfN8zDIjA6,London,3565,1432,2276,0,"2009-07-07 15:58:08+00:00"
68139427,1,Ian,IanHopkinson_,https://twitter.com/IanHopkinson_,https://pbs.twimg.com/profile_images/1741964130/ProfilePic1_normal.jpg,"...aka @SmallCasserole Scientist. Physicist. ooo...looker extraordinaire. Mr @HappyMouffetard. Senior Data Scientist at @ScraperWiki","Cheshire, UK",http://t.co/LOOex32J8M,London,1956,708,38851,0,"2009-08-23 13:05:10+00:00"
85289376,1,ICRC,ICRC,https://twitter.com/ICRC,https://pbs.twimg.com/profile_images/1259559734/ICRC_normal.jpg,"International Committee of the Red Cross ensuring humanitarian protection and assistance for victims of war and other situations of violence.",Geneva,http://t.co/NfFAtwJFCn,Bern,217851,626,5057,1,"2009-10-26 11:05:15+00:00"
148760879,1,aidinfo,aidinfo,https://twitter.com/aidinfo,https://pbs.twimg.com/profile_images/1149373454/aidinfo_logo_twitter_normal.jpg,"We work to reduce poverty by making aid and other resources more effective through making them more
transparent and accountable. aidinfo is part of @devinitorg","Bristol, UK",http://t.co/068HMcdfdK,Amsterdam,5765,1384,1635,0,"2010-05-27 14:44:56+00:00"
335868304,1,HIF,The_HIF,https://twitter.com/The_HIF,https://pbs.twimg.com/profile_images/378800000072095154/0e166abfd853a4efeb2fa655335a2452_normal.jpeg,"Supporting organisations & individuals to identify, nurture & share innovative & scalable solutions to the challenges facing effective humanitarian assistance.","Humanitarian Innovation Fund",http://t.co/GHra84Mvx4,Amsterdam,1810,813,936,0,"2011-07-15 11:18:23+00:00"
64777298,1,"Hemant Purohit",hemant_Pt,https://twitter.com/hemant_Pt,https://pbs.twimg.com/profile_images/478872485710942208/fbJJZUbV_normal.png,"Computational Social Scientist- Coordination, Social Dynamics: Influence-Engagement-Evolution, Crisis Resp, Social Good. ICCM-13 fellow. #IBMResearch #MSR #QCRI","Dayton, US",http://t.co/hpJwFneiJU,"Eastern Time (US & Canada)",498,285,4756,0,"2009-08-11 17:41:27+00:00"
207697817,1,"Samuel EUSTACHI",SamEustachi,https://twitter.com/SamEustachi,https://pbs.twimg.com/profile_images/1500916883/cat_pirate_poster_print-p228675305995870147vsu7_325_normal.jpg,"",Luxembourg,,,16,14,17,0,"2010-10-25 21:29:37+00:00"
7794562,1,"CJ Hendrix",cj_hendrix,https://twitter.com/cj_hendrix,https://pbs.twimg.com/profile_images/1197729713/profile_pic_640x640_normal.jpg,"","Geneva, Switzerland",,Paris,81,28,37,0,"2007-07-29 02:45:59+00:00"
31556904,1,"Ocha Colombia",ochacolombia,https://twitter.com/ochacolombia,https://pbs.twimg.com/profile_images/3056538795/7c443a40f604ea2475e54b22eddde169_normal.png,"Oficina de las Naciones Unidas para la Coordinación de Asuntos Humanitarios (OCHA). Buscamos movilizar y coordinar una respuesta humanitaria efectiva","Bogotá, Colombia",http://t.co/kyu4giuBMt,Bogota,13021,364,3664,1,"2009-04-15 23:16:59+00:00"
293538523,1,"Valerie Amos",ValerieAmos,https://twitter.com/ValerieAmos,https://pbs.twimg.com/profile_images/472024569998368768/SWhSVkz8_normal.jpeg,"The official Twitter account of the Under-Secretary-General for Humanitarian Affairs and Emergency Relief Coordinator, Valerie Amos.","",http://t.co/vqO7YwEHWE,"Eastern Time (US & Canada)",30823,250,1050,0,"2011-05-05 14:37:06+00:00"
39582891,1,"Luis Capelo",luiscape,https://twitter.com/luiscape,https://pbs.twimg.com/profile_images/477317300949774336/6Xdy5Xv2_normal.jpeg,"Humanitarian by passion. Data nerd. Works for @UNOCHA and part of the @humdata team. Tweets are my very extremely own.","New York, NY",http://t.co/8ntbXZRslf,Vienna,625,1098,810,0,"2009-05-12 20:07:37+00:00"
18638602,1,"Andrej Verity",andrejverity,https://twitter.com/andrejverity,https://pbs.twimg.com/profile_images/378800000324574947/607835c7fe9329664c68d7d4debeca8a_normal.jpeg,"Disaster responder and information management officer for UN-OCHA. Tweets are my personal opinion only.","Geneva, Switzerland",http://t.co/XjkdAH12qE,Bern,1731,572,2257,0,"2009-01-05 17:50:28+00:00"
157958919,1,"Carsten Keßler",carstenkessler,https://twitter.com/carstenkessler,https://pbs.twimg.com/profile_images/378800000044204246/7f912c28807b4303b126cbc226cab7b2_normal.png,"Into Linked Open Data, emergency management, volunteered geographic information. German expat. Assistant professor for GIScience at @Hunter_College, NYC.","New York",http://t.co/RMNltnegkd,Berlin,370,359,962,0,"2010-06-21 10:43:23+00:00"
21303235,1,UNOCHA,UNOCHA,https://twitter.com/UNOCHA,https://pbs.twimg.com/profile_images/2566881686/w6cxnl66cv46erdielyp_normal.jpeg,"The United Nations Office for the Coordination of Humanitarian Affairs (OCHA) mobilizes & coordinates humanitarian assistance to people in need worldwide.","",http://t.co/CfcJS2liQ1,"Eastern Time (US & Canada)",67851,1043,10144,1,"2009-02-19 14:41:13+00:00"
